{
  "$schema": "http://json-schema.org/draft-07/schema#",
  "title": "PowerShell Extension Build Configuration",
  "description": "Configuration file for the PowerShell Chrome extension build & deploy script with pnpm support. All paths are resolved relative to run.ps1's directory.",
  "type": "object",
  "required": ["projectName", "extensionDir"],
  "properties": {
    "$schema": {
      "type": "string",
      "description": "Path to this schema file for IDE autocomplete",
      "default": "spec/14-imported/powershell-integration/schemas/powershell.schema.json"
    },
    "projectName": {
      "type": "string",
      "description": "Display name for the project shown in console output",
      "examples": ["Marco Chrome Extension", "My Extension"]
    },
    "rootDir": {
      "type": "string",
      "default": ".",
      "description": "Repo root. Used for git pull, root-level npm install, and standalone-script builds. Resolved relative to run.ps1."
    },
    "extensionDir": {
      "type": "string",
      "default": ".",
      "description": "Where the extension's package.json, manifest.json, vite.config.ts, and node_modules live. All Push-Location, pnpm install, pnpm run build, and .npmrc/.pnp.cjs writes target this directory. Use '.' when extension lives at repo root, or a sub-folder name when nested.",
      "examples": [".", "chrome-extension", "packages/extension"]
    },
    "distDir": {
      "type": "string",
      "default": "dist",
      "description": "Build output folder, resolved relative to extensionDir. The deploy step copies <extensionDir>/<distDir>/ into the target browser profile.",
      "examples": ["dist", "build", "out"]
    },
    "buildCommand": {
      "type": "string",
      "default": "pnpm run build",
      "description": "Production build command, executed inside extensionDir",
      "examples": ["pnpm run build", "npm run build", "bun run build"]
    },
    "devCommand": {
      "type": "string",
      "default": "pnpm run dev",
      "description": "Dev/watch command, executed inside extensionDir",
      "examples": ["pnpm run dev", "npm run dev", "vite"]
    },
    "installCommand": {
      "type": "string",
      "default": "pnpm install",
      "description": "Dependency install command, executed inside extensionDir",
      "examples": ["pnpm install", "npm install", "pnpm install --prod=false"]
    },
    "cleanPaths": {
      "type": "array",
      "items": {"type": "string"},
      "default": ["dist", "node_modules", ".vite", ".pnp.cjs"],
      "description": "Paths removed by -f / -r flag, resolved relative to extensionDir. Supports wildcards.",
      "examples": [
        ["dist", "node_modules", ".vite", ".pnp.cjs"],
        ["dist", "node_modules", ".cache"]
      ]
    },
    "defaultProfile": {
      "type": "string",
      "default": "Default",
      "description": "Browser profile used when -pr flag is omitted"
    },
    "browserExePath": {
      "type": "string",
      "default": "",
      "description": "Optional override for the Chrome/Edge executable. Use for Chrome for Testing, Chromium, or custom browser installs. When empty, auto-detects based on -e flag.",
      "examples": [
        "C:\\chrome-testing\\chrome.exe",
        "C:\\Program Files\\Google\\Chrome\\Application\\chrome.exe"
      ]
    },
    "chromeUserDataDir": {
      "type": "string",
      "default": "",
      "description": "Override Chrome user data directory. When empty, uses %LOCALAPPDATA%\\Google\\Chrome\\User Data"
    },
    "edgeUserDataDir": {
      "type": "string",
      "default": "",
      "description": "Override Edge user data directory. When empty, uses %LOCALAPPDATA%\\Microsoft\\Edge\\User Data"
    },
    "prerequisites": {
      "type": "object",
      "properties": {
        "node": {
          "type": "boolean",
          "default": true,
          "description": "Validate Node.js is installed"
        },
        "pnpm": {
          "type": "boolean",
          "default": true,
          "description": "Validate pnpm is installed (enables pnpm-specific code paths)"
        },
        "npm": {
          "type": "boolean",
          "default": false,
          "description": "Verify npm is available (deprecated, use pnpm)"
        }
      },
      "additionalProperties": false,
      "description": "Which prerequisites to check and auto-install"
    },
    "usePnp": {
      "type": "boolean",
      "default": true,
      "description": "Prefer pnpm Plug'n'Play. Auto-falls back to isolated linker on Node >= 24 or cross-drive stores"
    },
    "pnpmStorePath": {
      "type": "string",
      "default": "E:/.pnpm-store",
      "description": "Content-addressable pnpm store location"
    },
    "requiredPackages": {
      "type": "array",
      "items": {"type": "string"},
      "default": ["vite", "tailwindcss", "autoprefixer"],
      "description": "Packages preflight checks for inside extensionDir/node_modules",
      "examples": [
        ["vite", "tailwindcss", "autoprefixer"],
        ["vite", "react", "react-dom", "lucide-react"]
      ]
    },
    "standaloneArtifacts": {
      "type": "object",
      "description": "Lists standalone-scripts/<folder> outputs the build verifies after compilation",
      "required": ["baseDir", "required"],
      "properties": {
        "baseDir": {
          "type": "string",
          "description": "Root directory for standalone scripts, relative to rootDir",
          "default": "standalone-scripts"
        },
        "required": {
          "type": "array",
          "items": {
            "type": "object",
            "required": ["folder", "files"],
            "properties": {
              "folder": {
                "type": "string",
                "description": "Standalone script folder name (e.g., marco-sdk, macro-controller, xpath)"
              },
              "files": {
                "type": "array",
                "items": {"type": "string"},
                "description": "Required output files that must exist in standalone-scripts/<folder>/dist/"
              }
            }
          }
        }
      }
    }
  },
  "additionalProperties": false
}
